ILN	ELN	Name der Einrichtung	ISIL
0001	1999	GBV/VZG	
0011	0001	SBB-PK Berlin	DE-1a
0019	2004	ZDB	
0019	2012	GND	
0019	2014	Basisklassifikation	
0019	2015	IKAR	
0019	2028	VD17	
0019	2034	VD16	
0019	2049	VD18	
0020	0084	Universitätsbibliothek Braunschweig	DE-84
0021	0046	Staats- und  Universitätsbibliothek Bremen	DE-46
0022	0018	Staats- und Universitätsbibliothek Carl von Ossietzky , Hamburg	DE-18
0022	0018/0006	Universität Hamburg, Institut für Angewandte Botanik 	
0022	0018/0008	Universität Hamburg, Geographische Gesellschaft 	
0022	0018/0012	Universität Hamburg, Institut für Romanistik, Französisch-Italienische Abteilung	
0022	0018/0015	Universität Hamburg, Hamburger Sternwarte am Fachbereich Physik der Universität Hamburg, Fachbibliothek Astronomie und Astrophysik	DE-18-15
0022	0018/0019	Universität Hamburg, Fachbereichsbibliothek Biologie, Standort Grindel	DE-18-19
0022	0018/0021	Universität Hamburg, Institut für Germanistik, Bibliothek 	DE-18-21
0022	0018/0024	Universität Hamburg, Bibliothek des Instituts für Geologie 	DE-18-24
0022	0018/0039	Universität Hamburg, Institut für Anglistik und Amerikanistik, Bibliothek 	DE-18-39 
0022	0018/0045	Universität Hamburg, Philosophisches Seminar	
0022	0018/0047	Universität Hamburg, Physikalische Institute Jungiusstraße, Bibliothek 	DE-18-47 
0022	0018/0048	Universität Hamburg, Department Chemie der Universität Hamburg, Bibliothek 	DE-18-48
0022	0018/0053	Universität Hamburg, Institut für Alte Geschichte 	
0022	0018/0054	Universität Hamburg, Institut für Griechisch, Latein Philologie	
0022	0018/0055	Universität Hamburg, Asien Afrika Institut 	
0022	0018/0057	Universität Hamburg, Institut für Geographie, Bibliothek	DE-18-57
0022	0018/0059	Universität Hamburg, Institut für Slavistik, Bibliothek 	DE-18-59 
0022	0018/0060	Universität Hamburg, Historisches Seminar	
0022	0018/0061	Universität Hamburg,Fachbereichsbibliothek SLM, Teilbibliothek Spanisch/Portugiesisch 	DE-18-61
0022	0018/0064	Universität Hamburg, Universitätsklinikum Hamburg-Eppendorf, Ärztliche Zentralbibliothek	DE-18-64
0022	0018/0069	Universität Hamburg, Fachbereich Erziehungswissenschaften	
0022	0018/0070	Universität Hamburg, Seminar Deutsches Nord. Recht 	
0022	0018/0071	Universität Hamburg, Institut für Kriminalwissenschaften	
0022	0018/0073	Universität Hamburg, Institut für Seerecht und Seehandelsrecht (ISSR)	
0022	0018/0074	Universität Hamburg, Fachbereich Psychologie 	
0022	0018/0075	Universität Hamburg, Institut für Allgemeine Botanik	
0022	0018/0076	Universität Hamburg, Fachbibliothek Sozialwissenschaften 	DE-18-76
0022	0018/0079	Universität Hamburg, Seminar Römisches Recht 	
0022	0018/0081	Universität Hamburg, Seminar für Kunstgeschichte	
0022	0018/0088	Universität Hamburg, Institut für  Internationale Angelegenheiten	
0022	0018/0114	Universität Hamburg, Universität Hamburg, Musikwissenschaftliches Institut, Bibliothek	DE-18-114 
0022	0018/0131	Universität Hamburg, Institut für Volkskunde 	
0022	0018/0133	Universität Hamburg,  Seminar für Arbeitsrecht 	
0022	0018/0141	Universität Hamburg, Institut für Hydrobiologie 	
0022	0018/0148	Universität Hamburg, Institut für Kriminalwissenschaften	
0022	0018/0156	Universität Hamburg, Fachbereichsbibliothek Sprache Literatur Medien, Teilbibliothek Niederländisch	DE-18-156 
0022	0018/0161	Universität Hamburg, Theologische Bibliothek, Fachbereich Evangelische Theologie und Institut für Katholische Theologie	DE-18-161
0022	0018/0172	Universität Hamburg, Seminar für Rechtsphilosophie	
0022	0018/0214	Universität Hamburg, Fachbereich Sport	
0022	0018/0219	Universität Hamburg, Institut für Finno-Ugristik / Uralistik, Bibliothek 	DE-18-219
0022	0018/0226	Universität Hamburg, Institut für Friedensforschung und Sicherheitspolitik, Bibliothek 	DE-18-226 
0022	0018/0227	Universität Hamburg, Geschichte der Juden 	
0022	0018/0228	Universität Hamburg, Department Informatik, Bibliothek	DE-18-228
0022	0018/0232	Universität Hamburg, Institut für Erziehungswissenschaften	
0022	0018/0235	Universität Hamburg, Institut für  Geschichte der Naturwissenschaften	
0022	0018/0240	Universität Hamburg, Institut für Meereskunde	
0022	0018/0241	Universität Hamburg, Seminar Fin Steuerrecht	
0022	0018/0242	Universität Hamburg, Seminar Verwaltung	
0022	0018/0250	Universität Hamburg, Forschung Zeitgeschichte	
0022	0018/0254	Universität Hamburg, Stiftung Europa-Kolleg, Institut für Integrationsforschung, Bibliothek 	DE-18-254
0022	0018/0261	Universität Hamburg, Fakultät für Wirtschafts- und Sozialwissenschaften, Fachbibliothek Wirtschaftswissenschaften 	DE-18-261
0022	0018/0263	Universität Hamburg, Bibliothek - Mathematik und Geschichte der Naturwissenschaften 	DE-18-263
0022	0018/0264	Universität Hamburg, Seminar Dt. Nord. Rechts.	
0022	0018/0267	Universität Hamburg, Institut für Recht Esa 	
0022	0018/0269	Universität Hamburg, Physikalische Institute Bahrenfeld	DE-18-269
0022	0018/0270	Universität Hamburg, Physikalische Institute Bahrenfeld, Theoretische Physik	DE-18-270
0022	0018/0271	Universität Hamburg, Metereologisches Institut	
0022	0018/0273	Universität Hamburg, Seminar für Bürgerles Recht 	
0022	0018/0276	Universität Hamburg, Seminar Allgemeines Prozeßrecht	
0022	0018/0278	Universität Hamburg, Institut für Allgemeine und Angewandte Sprachwissenschaft, Abteilung für Sprachlehrforschung, Bibliothek für Sprachlehrforschung	DE-18-278
0022	0018/0289	Universität Hamburg, Institut für Seerecht 	
0022	0018/0290	Universität Hamburg, Fachbereichsbibliothek Sprache Literatur Medien, Teilbibliothek Exilliteratur	 DE-18-290
0022	0018/0291	Universität Hamburg, Regionales Rechnenzentrum	
0022	0018/0292	Universität Hamburg, Institut für Ethnologie	
0022	0018/0294	Universität Hamburg, FB Sprache Literatur Medien, Teilbibliothek Allgemeine Sprachwissenschaft/Indogermanistik 	DE-18-294
0022	0018/0295	Universität Hamburg, Institut für Deutsche Gebärdensprache und Kommunikation Gehörloser	DE-18-295
0022	0018/0296	Universität Hamburg, Hamburger Bibliothek für Universitätsgeschichte	DE-18-296 
0022	0018/0297	Universität Hamburg, Zentrum für Molekulare Neurobiologie, Bibliothek 	DE-18-297
0022	0018/0303	Universität Hamburg, Asien-Afrika-Institut, Bibliothek	DE-18-303
0022	0018/0304	Universität Hamburg, Zentralbibliothek Recht 	DE-18-304
0022	0018/0305	Universität Hamburg, Fachbereichsbibliothek Biologie, Standort Klein Flottbek 	DE-18-305
0022	0018/0306	Universität Hamburg, Bibliotheks- und Informationsservice (BIS) für Erdsystemforschung 	DE-18-306
0022	0018/0307	Universität Hamburg, Martha-Muchow-Bibliothek, Fachbibliothek für Erziehungswissenschaft, Psychologie und Bewegungswissenschaft 	DE-18-307
0022	0018/0308	Universität Hamburg, Fakultät Geisteswissenschaften, Fachbereichsbibliothek Kulturwissenschaften 	DE-18-308
0022	0018/0309	Universität Hamburg, Zentralbibliothek Philosophie, Geschichte und Klassische Philologie 	DE-18-309
0022	0018/0310	Universität Hamburg,Testbibliothek der Fakultät Erziehungswissenschaft, Psychologie und Bewegungswissenschaft	DE-18-310
0022	0018/0311	Universität Hamburg, Konfuzius-Institut e.V., Bibliothek 	DE-18-311
0022	0018/0312	Universität Hamburg, Zentrale Stelle Normdaten 	DE-18-312
0022	0018/0313	Nordost-Institut an der Universität Hamburg (IKGN e.V.), Bibliothek	DE-18-313 
0022	0018/0314	Universität Hamburg, Institut f. Bodenkunde HH	DE-18-314
0023	0830	TUB Hamburg-Harburg	DE-830
0024	0008	UB Kiel	DE-8
0024	0008/0002	UB Kiel, Fachbibliothek Theologie	DE-8-2
0024	0008/0003	UB Kiel, Fachbibliothek am Juristischen Seminar	DE-8-3
0024	0008/0004	Fachbibliothek am Walther-Schücking-Institut für Internationales Recht 	DE-8-4
0024	0008/0006	UB Kiel, Fachbibliothek am Institut für Osteuropäisches Recht 	DE-8-6
0024	0008/0007	UB Kiel, Fachbibliothek am Institut für Wirtschafts- und Steuerrecht 	DE-8-7
0024	0008/0009	UB Kiel, Fachbibliothek für Wirtschaftswissenschaften	DE-8-9 
0024	0008/0010	UB Kiel, Fachbibliothek Sozialwissenschaften 	DE-8-10
0024	0008/0012	UB Kiel Anatomie /Biochemie	
0024	0008/0015	UB Kiel , Fachbibliothek an der Medizin- und Pharmaziehistorischen Sammlung Kiel 	DE-8-15
0024	0008/0034	UB Kiel, Rechtsmedizin	
0024	0008/0037	UB Kiel, Fachbibliothek am Philosophischen Seminar 	DE-8-37
0024	0008/0038	UB Kiel, Fachbibliothek für Pädagogik 	DE-8-38
0024	0008/0039	UB Kiel, Fachbibliothek am Institut für Psychologie 	DE-8-39 
0024	0008/0040	UB Kiel, Fachbibliothek Geschichte	DE-8-40 
0024	0008/0042	UB Kiel, Archäologisches Institut	
0024	0008/0044	UB Kiel, Fachbibliothek am Kunsthistorischen Institut 	DE-8-44 
0024	0008/0045	UB Kiel, Fachbibliothek an der Kunsthalle	DE-8-45
0024	0008/0046	UB Kiel, Fachbibliothek am Musikwissenschaftlichen Institut 	DE-8-46
0024	0008/0047	UB Kiel, Fachbibliothek am Seminar für Europäische Ethnologie/Volkskunde 	DE-8-47
0024	0008/0048	UB Kiel, Fachbibliothek am Institut für Skandinavistik, Frisistik und Allg. Sprachwissenschaft, Bereich Allg.Sprachwissenschaft 	DE-8-48
0024	0008/0049	UB Kiel, Phonetik	
0024	0008/0050	UB Kiel, Fachbibliothek am Institut für Klassische Altertumskunde	DE-8-50 
0024	0008/0052	UB Kiel, Fachbibliothek Germanistik (Sprache / Literatur / Medien) 	DE-8-52
0024	0008/0054	UB Kiel, Fachbibliothek am Institut für Skandinavistik, Frisistik und Allg. Sprachwissenschaft, Bereich Skandinavistik 	DE-8-54 
0024	0008/0055	UB Kiel, Fachbibliothek am Englischen Seminar 	DE-8-55
0024	0008/0056	UB Kiel, Fachbibliothek am Romanischen Seminar 	DE-8-56
0024	0008/0057	UB Kiel, Fachbibliothek am Institut für Slavistik 	DE-8-57
0024	0008/0058	UB Kiel, Fachbibliothek am Institut für Sport und Sportwissenschaften	DE-8-58
0024	0008/0059	UB Kiel, Fachbibliothek am Institut für Ur- und Frühgeschichte 	DE-8-59 
0024	0008/0060	UB Kiel, Fachbibliothek Mathematik/Informatik/Rechenzentrum (Bereich Mathematik) 	DE-8-60 
0024	0008/0062	UB Kiel, Fachbibliothek Physikzentrum 	DE-8-62
0024	0008/0064	UB Kiel, Fachbibliothek Chemie (Bereich Anorg. und Org. Chemie)	DE-8-64
0024	0008/0066	UB Kiel, Fachbibliothek am Pharmazeutischen Institut, Abteilung Pharmazeutische Chemie und Pharmazeutische Technologie 	DE-8-66
0024	0008/0067	UB Kiel, Pharmazeutische Biologie	DE-8-67
0024	0008/0068	UB Kiel, Biologie Zentrum	
0024	0008/0069	UB Kiel, Fachbibliothek am Institut für Geowissenschaften 	DE-8-69
0024	0008/0070	UB Kiel, Fachbibliothek am Geographischen Institut 	DE-8-70
0024	0008/0072	UB Kiel, Fachbibliothek am Institut für Pflanzenbau und –züchtung 	DE-8-72
0024	0008/0073	UB Kiel, Fachbibliothek am Institut für Phytopathologie	DE-8-73
0024	0008/0074	UB Kiel, Fachbibliothek am Institut für Tierernährung, Stoffwechselphysiologie 	DE-8-74
0024	0008/0075	UB Kiel, Fachbibliothek am Institut für Tierzucht und Tierhaltung 	DE-8-75
0024	0008/0076	UB Kiel, Landwirtschaftliche Verfahrens Technik	DE-8-76
0024	0008/0079	UB Kiel, Humanernährung	DE-8-79
0024	0008/0081	UB Kiel, Fachbibliothek Ökologie und Wasserwirtschaft 	DE-8-81
0024	0008/0100	Landesarchiv Schleswig-Holstein, Bibliothek	DE-452 
0024	0008/0102	Universität Kiel, Bibliothek des Lorenz-von-Stein-Instituts für Verwaltungswissenschaften 	DE-8-102
0024	0008/0391	UB Kiel Psychologische Pädagogig	
0024	0008/0512	UB Kiel, Fachbibliothek am Seminar für Orientalistik 	DE-8-51b
0024	0008/0541	UB Kiel, Fachbibliothek am Institut für Skandinavistik, Frisistik und Allg. Sprachwissenschaft, Bereich Frisistik	DE-8-541
0024	0008/0601	UB Kiel, Fachbibliothek Mathematik/Informatik/Rechenzentrum (Bereich Informatik) 	DE-8-601
0024	0008/0683	UB Kiel Zoologisches Museum	
0024	0008/0710	UB Kiel, Fachbibliothek am Institut für Internationales Privat- und Verfahrensrecht 	DE-8-710
0026	0206	ZBW - Leibniz-Informationszentrum Wirtschaft, Standort Kiel 	DE-206
0026	0206/0001	ZBW - Leibniz-Informationszentrum Wirtschaft, Standort Hamburg	DE-206H
0030	0104	UB Clausthal	DE-104
0030	0104/0001	UB Clausthal Bibliographie	--
0031	0027	Thüringer Universitäts- und Landesbibliothek (ThULB) Jena	DE-27
0032	3400	UB Ilmenau	DE-Ilm1
0033	3550	Hamburg Bibliographie	--
0034	3551	HS für Angewandte Wissenschaften (HAW) Hamburg	--
0034	3551/0001	Hafen City Universität, Hamburg	DE-1373
0034	3551/0002	HS für Angewandte Wissenschaften Hamburg, Hochschulinformations- und Bibliotheksservice (HIBS), Fachbibliothek Technik, Wirtschaft, Informatik (HAW) Hamburg	DE-18-302
0034	3551/0004	HAW Hamburg, Hochschulinformations- und Bibliotheksservice (HIBS), Fachbibliothek Life Sciences 	DE-18-284
0034	3551/0005	HAW Hamburg, Hochschulinformations- und Bibliotheksservice (HIBS), Fachbibliothek Design Medien Information 	DE-18-285
0034	3551/0007	HAW Hamburg, Hochschulinformations- und Bibliotheksservice , (HIBS), Fachbibliothek Soziale Arbeit und Pflege 	DE-18-287
0039	0547	Universitätsbibliothek Erfurt / Forschungsbibliothek Gotha, Universitätsbibliothek Erfurt 	DE-547
0039	0547/0039	Forschungsbibliothek Gotha	 DE-39
0040	0007	Niedersächsische Staats- und Universitätsbibliothek Göttingen und Universität Göttingen	 DE-7
0040	0007/0001	SUB Göttingen,  Institut für Organische und Biomolekulare Chemie (IOBC)	DE-7-001
0040	0007/0003	Göttingen Mathematisches Institut	DE-7-003
0040	0007/0006	Universität Göttingen, Georg-Elias-Müller-Institut für Psychologie, Bibliothek  	DE-7-006
0040	0007/0011	SUB Göttingen, Zentrum Physiologie und Pathophysiologie, Zentrum Biochemie und Molekulare Zellbiologie, Bibliothek	DE-7-011
0040	0007/0037	Universität Göttingen, Zentralbibliotheken der Juristischen Fakultät	DE-7-037
0040	0007/0041	Universität Göttingen, Institut für Völkerrecht und Europarecht, Bibliothek 	DE-7-041
0040	0007/0042	Universität Göttingen, Vereinigte Theologische Seminare, Bibliothek	DE-7-042
0040	0007/0050	Universität Göttingen, Pädagogisches Seminar, Bibliothek	DE-7-050
0040	0007/0118	Universität Göttingen, Institut für Landwirtschaftsrecht, Bibliothek 	DE-7-118 
0040	0007/0155	Universität Göttingen, Institut für Römisches Recht und Gemeines Recht, Bibliothek 	DE-7-155 
0040	0007/0160	Universität Göttingen, Bibliothek Waldweg 	DE-7-160
0040	0007/0196	Universität Göttingen, Geologie 	
0040	0007/0200	Universität Göttingen, Institut für Arbeitsrecht, Bibliothek 	DE-7-200
0040	0007/0201	Universität Göttingen, Institut für Allgemeine Staatslehre und Politische Wissenschaften an der Juristischen Fakultät, Bibliothek 	DE-7-201
0040	0007/0730	Universität Göttingen, Zentrum Interdisziplinäre Einrichtungen, Abteilung Medizinische Informatik, Handbibliothek	DE-7-730
0047	3047	Max-Planck-Institut für Sonnensystemforschung, Bibliothek , Göttingen	DE-Lin1b
0049	3049	Max-Planck-Institut zur Erforschung multireligiöser und multiethnischer Gesellschaften, Bibliothek, Göttingen	DE-Goe164 
0050	0023	Herzog August Bibliothek (HAB) , Wolfenbüttel	DE-23
0055	3055	Max-Planck-Institut für Multidisziplinäre Naturwissenschaften, Göttingen	DE-Goe116
0060	0705	Helmut-Schmidt-Universität, Universität der Bundeswehr Hamburg, Universitätsbibliothek  (HSU), Hamburg	DE-705
0061	0032	Herzogin Anna Amalia Bibliothek / Klassik Stiftung Weimar (HAAB), Weimar	DE-32
0062	0028	UB Rostock	DE-28
0062	0028/0001	Leibniz-Institut für Ostseeforschung Warnemünde, Bibliothek 	DE-Wa1
0062	0028/0002	Leibniz-Institut für Atmosphärenphysik e.V. an der Universität Rostock, Bibliothek  Kühlungsborn	DE-Kue3
0062	0028/0003	Forschungsinstitut für Nutztierbiologie, Dummersdorf (FBN)	DE-R48
0062	0028/0004	Leibniz-Institut für Katalyse	DE-R65
0062	0028/0005	Hochschule für Musik und Theater Rostock, Bibliothek, Rostock	DE-563
0062	0028/0006	Historische Bibliothek des Museums Güstrow	DE-2161
0063	3401	UB Weimar	DE-Wim2
0064	3064	ULB Halle Uni. Bibliographie	
0065	0003	Universitäts- und Landesbibliothek Sachsen-Anhalt / Zentralex, ULB Halle	DE-3
0065	0003/0001	ULB Halle, Zweigbibliothek Vorderer Orient / Ethnologie 	DE-3-1
0065	0003/0004	ULB Halle, Zweigbibliothek Heide-Süd 	DE-3-4
0065	0003/0006	ULB Halle,Zweigbibliothek Medizin-Campus 	DE-3-6
0065	0003/0008	ULB Halle, Zweigbibliothek Geobotanik 	DE-3-8
0065	0003/0010	ULB Halle Zweigbibliothek Franckeplatz 	DE-3-10
0065	0003/0011	ULB Halle, Zweigbibliothek Rechtswissenschaft 	DE-3-11
0065	0003/0018	ULB Halle, Zweigbibliothek Steintorcampus	DE-3-18
0065	0003/0019	ULB Halle,  Zweigbibliothek Geowissenschaften	DE-3-19 
0065	0003/0026	ULB Halle, Zweigbibliothek Klassische Altertumswissenschaften 	DE-3-26
0065	0003/0027	ULB Halle, Zweigbibliothek Wirtschaftswissenschaften	DE-3-27 
0065	0003/0038	ULB Halle, Zweigbibliothek Musik 	DE-3-38
0065	0003/0150	ULB Halle, Zweigbibliothek Universitätsklinikum 	DE-3-150
0065	0003/0179	ULB Halle, Zweigbibliothek Europäische Aufklärung / Interdisziplinäres Zentrum für die Erforschung der Europäischen Aufklärung 	DE-3-179
0066	3066	Burg Giebichenstein Kunsthochschule Halle, Hochschulbibliothek 	DE-Ha125
0069	0009	UB Greifswald	DE-9
0070	0089	Technische Informationsbibliothek (TIB) / Leibniz-Informationszentrum Technik und Naturwissenschaften und Universitätsbibliothek 	DE-89
0072	0035	Gottfried Wilhelm Leibniz Bibliothek - Niedersächsische Landesbibliothek (GWLB) Hannover	DE-35
0073	0095	Stiftung Tierärztliche Hochschule Hannover, Bibliothek (TiHo) Hannover	DE-95
0074	0354	Medizinische Hochschule Hannover, Bibliothek (MHH) Hannover	DE-354
0077	3077	Nds. Landtag, Hannover	DE-Hv14
0078	0115	StB Hannover	DE-115
0090	3090	UB Hildesheim	DE-Hil2
0091	3091	HAWK HS für angewandte Wissenschaft und Kunst Hildesheim/Holzminden/Göttingen, Bibliothek, Elektronische Ressourcen 	DE-Hil3
0091	3091/0001	HAWK HS für angewandte Wissenschaft und Kunst Hildesheim/Holzminden/Göttingen, Bibliothek Naturwissenschaften und Technik	 DE-Hil3-1
0091	3091/0002	HAWK HS für angewandte Wissenschaft und Kunst Hildesheim/Holzminden/Göttingen, Ressourcenmanagement 	DE-Hil3-2
0091	3091/0003	HAWK HS für angewandte Wissenschaft und Kunst Hildesheim/Holzminden/Göttingen, Bibliothek Management, Soziale Arbeit, Bauen	DE-Hil3-3
0091	3091/0009	HAWK HS für angewandte Wissenschaft und Kunst Hildesheim/Holzminden/Göttingen, Campus-Bibliothek 	DE-Hil3-9
0092	0033	Landesbibliothek Mecklenburg-Vorpommern (LBMV), Schwerin	DE-33
0095	3095	HS Merseburg	DE-542
0095	3095/0001	Hochschule  Merseburg	DE-542
0096	3096	Hamburger Gerichtsbibliotheken	--
0096	3096/0001	Gerichtsbibliothek Lübeckertordamm	DE-H358
0096	3096/0002	Landessozialgericht und Sozialgericht Hamburg, Bibliothek 	DE-H123
0096	3096/0003	Landesarbeitsgericht und Arbeitsgericht Hamburg, Bibliothek und Tarifvertragssammlung	DE-H359
0096	3096/0004	Hanseatisches Oberlandesgericht, Bibliothek	DE-H50
0096	3096/0005	Land- und Amtsgericht Hamburg, Bibliothek	DE-H42
0098	3402	Hochschule für Musik Franz Liszt, Hochschulbibliothek, Weimar  	DE-Wim8
0099	3099	Norddeutsche HS für Rechtspflege, Hildesheim	--
0100	3100	Otto-von-Guericke-Universität, Universitätsbibliothek Magdeburg	 DE-Ma9 
0100	3100/0001	Otto-von-Guericke-Universität, FB Erziehungswissenschaften, Magdeburg	--
0101	3101	Otto-von-Guericke-Universität, Universitätsbibliothek, Medizinische Zentralbibliothek (MZB), Magdeburg	DE-Ma14 
0101	3101/0045	Leibniz-Institut für Neurobiologie, Wissenschaftliche Bibliothek, Magdeburg  	DE-Ma45
0104	0068	Schleswig-Holsteinische Landesbibliothek (LB) Kiel	DE-68
0105	0841	Zentrale Hochschulbibliothek (ZHSB) Lübeck	DE-841
0110	3110	Leuphana Universität Lüneburg, Medien- und Informationszentrum, Universitätsbibliothek Lüneburg	DE-Luen4
0111	0961/0006	Hochschule 21, Buxtehude	DE-963
0113	3113	Staatsarchiv Hamburg	DE-2089
0114	3114	Akademie der Polizei, Hamburg	DE-18-301
0118	3329	Hochschule Anhalt , Hochschulbibliothek (HSB)  Anhalt	DE-Kt1
0118	3329/0004	Stiftung Bauhaus Dessau, Bibliothek 	DE-De15
0119	3119	Thür. Behördenbibl. Erfurt	
0119	3119/0001	Thüringer Ministerium für Bildung, Wissenschaft und Kultur, Bibliothek, Erfurt 	DE-Ef28
0119	3119/0002	Bibliothek des  Thüringer Landtags	DE-2500
0119	3119/0003	Bibliothek des Thüringer Justizministeriums	
0119	3119/0004	Bibliothek der Thüringer Staatskanzlei	DE-4078
0119	3119/0005	Bibliothek des Thüringer Innenministeriums	
0119	3119/0006	Bibliothek des Thüringer Finanzministeriums	DE-EF32
0119	3119/0008	Bibliothek des Ministeriums für Soziales, Familie und Gesundheit	
0119	3119/0009	Bibliothek des Thüringer Ministeriums für Wirtschaft und Arbeit	
0119	3119/0010	Bibliothek des Thüringer Kultusministeriums	
0119	3119/0011	Bildungszentrum der Thüringer Landesverwaltung in Gotha und Verwaltungsfachhochschule für die öffentliche Verwaltung, Bibliothek 	DE-G11
0119	3119/0012	Thüringer Landesamt für Statistik	
0119	3119/0013	Landgericht Erfurt, Bibliothek 	DE-Ef21 
0119	3119/0014	Justizzentrum Erfurt	
0119	3119/0015	Justizzentrum Mühlhausen, Bibliothek Landgericht Mühlhausen	DE-Ms8 
0119	3119/0016	Thüringer Finanzgericht, Bibiothek	
0119	3119/0017	Staatsanwaltschaft Mühlhausen, Bibliothek	
`0119	3119/0018	Sozialgericht Nordhausen	
0120	0715	Bibliotheks-und Informationssystem der Carl von Ossietzky Universität Oldenburg (BIS) 	DE-715
0121	0045	Landesbibliothek (LB) Oldenburg	DE-45
0122	0897	Jade Hochschule Wilhelmshaven/Oldenburg/Elsfleth, Studienort Oldenburg, Bibliothek 	DE-897
0123	3311	Franckesche Stiftungen, Studienzentrum August Hermann Francke, Archiv und Bibliothek	DE-Ha33
0127	3564	Hochschule für Musik und Theater, Bibliothek HfMT Hamburg	DE-18-258
0129	3129	Department für Agrarökonomie und Rurale Entwicklung (DARE)	DE-7-061
0130	0700	Universitätsbibliothek Osnabrück 	DE-700
0131	3131	Universitätsbibliothek Vechta 	DE-Va1
0132	0959	HS Osnabrück	--
0132	0959/0001	Hochschule Osnabrück, Bibliothek Campus Westerberg 	DE-959 
0132	0959/0002	Hochschule Osnabrück, Bibliothek Campus Haste	DE-959-1 
0132	0959/0004	Hochschule Osnabrück, Bibliothek Campus Lingen 	DE-959-3 
0134	3134	Zeitschriftengesamtverzeichnis Göttingen (ZGG), Göttingen	--
0135	3313	Landesamt für Denkmalpflege und Archäologie (LDA), Halle	
0135	3313/0001	Landesamt für Denkmalpflege und Archäologie - Bibliothek, Halle	DE-Ha115
0136	3526	Hochschule Wismar, University of Applied Sciences: Technology, Business and Design, Hochschulbibliothek 	DE-Wis1
0138	0564	Hochschule Nordhausen, Hochschulbibliothek  	DE-564
0139	3568	Hochschule für Bildende Künste (HfbK), Hamburg, Bibliothek 	DE-18-26 
0140	0839	Jade Hochschule Wilhelmshaven/Oldenburg/Elsfleth, Studienort Wilhelmshaven, Bibliothek 	DE-839
0147	3528	Zentrale Hochschulbibliothek Flensburg  	DE-Fl3
0148	3529	Musikhochschule Lübeck, Bibliothek	DE-Lue12
0150	3406	Ernst-Abbe Hochschschule Jena	DE-J59
0151	0546	FH Erfurt	DE-546
0152	3405	FH Schmalkalden	DE-Shm2
0153	3315	MPI für Mikrostrukturphysik, Halle	DE-Ha94
0154	3713	Alfred-Wegener-Institut Helmholtz-Zentrum für Polar- und Meeresforschung, (AWI), Bibliothek Bremerhaven	DE-Bv2
0154	3713/0002	AWI Sylt	--
0154	3713/0003	AWI Helgoland	--
0154	3713/0004	AWI Potsdam	--
0156	0204	Ibero-Amerikanisches Institut Preußischer Kulturbesitz, Bibliothek (IAI SPK) Berlin	DE-204
0160	0755	HSB Emden/Leer	DE-755
0161	0960	HS Hannover	DE-960
0161	0960/0001	Bibliothek der Hochschule Hannover, Zentralbibliothek 	DE-960-1
0161	0960/0004	Bibliothek der Hochschule Hannover, Teilbibliothek Bioverfahrenstechnik 	DE-960-4
0161	0960/0007	Hochschule Hannover, Teilbibliothek Diakonie, Gesundheit und Soziales 	DE-960-7
0162	3162	Deutsches Schifffahrtsmuseum (DSM), Bremerhaven	DE-Bv3
0163	0996	Hochschule für Musik, Theater und Medien Hannover, Bibliothek 	DE-996
0164	0916	Ostfalia Hochschule für angewandte Wissenschaften, Bibliothek, Wolfenbüttel	DE-916
0165	0834	HBK Braunschweig	DE-834
0168	3168	Forschungszentrum Borstel	DE-Bst1
0170	3027	PTB Braunschweig + Berlin	--
0170	3027/0001	PTB Braunschweig	DE-Bs68
0170	3027/0002	PTB Berlin	DE-B108
0171	3309	Deutsche Akademie der Naturforscher Leopoldina, Bibliothek, Halle	DE-Ha2
0172	0048	StB Lübeck	DE-48
0175	3285	ifo Institut für Wirtschaftsforschung an der Universität München, Bibliothek	DE-M158a
0176	3703	Die Ostfries. Bibl. Aurich/Emden	--
0176	3703/0001	Landschaftsbibliothek, Aurich 	DE-Au3
0176	3703/0002	Johannes a Lasco Bibliothek Große Kirche Emden	DE-Em2
0176	3703/0003	Studienseminar Aurich	
0176	3703/0004	Schulbibliothek in Ostfriesland	
0176	3703/0005	Museumsbibliothek in Ostfriesland	
0178	3178	Universitätsbibliographie Magdeburg	
0179	8306	Akademie der Wissenschaften Berlin-Brandenburg (ADW)	DE-B4
0181	3181	Staatliche Museen zu Berlin, Preußischer Kulturbesitz, Kunstbibliothek 	DE-B11 
0181	3181/0010	Staatliche Museen zu Berlin, Preußischer Kulturbesitz, Kunstbibliothek,  Kulturforum 	--
0181	3181/0015	Staatliche Museen zu Berlin, Preußischer Kulturbesitz, Kunstbibliothek, Archäologische Bibliothek	DE-B11d
0181	3181/0020	Staatliche Museen zu Berlin, Preußischer Kulturbesitz, Kunstbibliothek, Ethnologisches Museum	DE-B11b
0181	3181/0030	Staatliche Museen zu Berlin, Preußischer Kulturbesitz, Kunstbibliothek, Museum Europäische3 Kulturen	DE-B11c
0181	3181/0050	Staatliche Museen zu Berlin, Preußischer Kulturbesitz, Institut für Museumsforschung, Bibliothek	DE-B11e
0181	3181/0060	Ägyptisches Museum und Papyrussammlung (ÄMP), Berlin	DE-B11f
0181	3181/0061	Papyrussammlung Berlin	DE-3181-61
0181	3181/0070	Antikensammlung	DE-B 32a1
0181	3181/0080	Museum für Fotografie	DE-3181-80
0181	3181/0090	Gemäldegalerie Berlin	DE-3181-90
0181	3181/0100	Kunstgewerbemuseum	DE-B 32a 6
0181	3181/0110	Kupferstichkabinett	DE-B 172a
0181	3181/0120	Museum Indische Kunst	DE-B 54 IK
0181	3181/0130	Museum Islamamische Kunst	DE-B 32a3
0181	3181/0140	Museum Ostasiatische Kunst	DE-B32a4
0181	3181/0150	Münzkabinett Berlin	DE-3181-150
0181	3181/0160	Alte Nationalgalerie	DE-B 32a 5
0181	3181/0170	Neue Nationalgalerie	DE-B 32a 5
0181	3181/0180	Hamburger Bahnhof Berlin	DE-3181-180
0181	3181/0190	Skulpturensammlung Berlin	DE-3181-190
0181	3181/0191	Museum für Byzantinische Kunst	DE-3181-191
